Timestamp,Question 0 (Organization),Question 0 Numerical,Question 0 Comment,Question 1 (Explanations),Question 1 Numerical,Question 1 Comment,Question 2 (Questions),Question 2 Numerical,Question 2 Comment,Question 3 (Visual Presentation),Question 3 Numerical,Question 3 Comment,Question 4 (Oral Presentation),Question 4 Numerical,Question 4 Comment,Question 5 (Availability),Question 5 Numerical,Question 5 Comment,Question 6 (Interest),Question 6 Numerical,Question 6 Comment,Question 7 (Effectiveness),Question 7 Numerical,Question 7 Comment,Question 8 (Attendance),Question 8 Numerical,Question 8 Comment,Question 9 (Assigned Work),Question 9 Numerical,Question 9 Comment,Question 10 (Printed Notes),Question 10 Numerical,Question 10 Comment,Question 11 (Textbook),Question 11 Numerical,Question 11 Comment,Question 12 (New Material),Question 12 Numerical,Question 12 Comment,Question 13 (Assigned Work Amount),Question 13 Numerical,Question 13 Comment,Question 14 (Hours Per Week),Question 14 Numerical,Question 14 Comment,Text Comments 0,Text Comments 1,Text Comments 2,Text Comments 3,Text Comments 4,Text Comments 5
2015-11-24T01:45:58,Excellent,0,,Just Right,2,,Excellent,0,,Excellent,0,,Excellent,0,,I did not seek help,5,,Very interesting,0,,Excellent,0,,90-100%,0,,Very helpful,0,,Very helpful,0,,No text required,3,,Okay,2,,Somewhat too much,1,,11-15 hours,3,,"What instructor has done well: Great character, loved his style of teaching. His examples and rough work was very helpful. He was also very passionate about showing us cool stuff which I appreciate. He does a good job at teaching new and experienced coders without confusing too many people.","Course's weak points: I found that some assignments became very hard all of a sudden. I got through it and learned a lot, but it took 24+ hours and there were no directly helpful examples taught in class.","Class atmosphere: Positively, Dave is a funny guy.",Other Comments: Great class
2015-11-24T11:14:46,Excellent,0,,Just Right,2,,Excellent,0,,Excellent,0,,Excellent,0,,Always,0,,Very interesting,0,,Excellent,0,,90-100%,0,,Very helpful,0,,Very helpful,0,,No opinion,4,,Okay,2,,Okay,2,,3-6 hours,1,,What instructor has done well: Witty and helpful. Makes the course fun.
2015-11-24T11:15:30,Excellent,0,,Just Right,2,,Excellent,0,,Excellent,0,,Excellent,0,,Most of the time,1,,Very interesting,0,,Excellent,0,,90-100%,0,,Very helpful,0,,No printed notes,3,,Helpful,1,,Okay,2,,Okay,2,,0-2 hours,0,,What instructor has done well: Dave was awesome.,Improvements to technique or style: Dave explains everything in a funny and interesting way.,Course's strong points: Dave was very helpful.,Course's weak points: I can't remember,"Class atmosphere: Dave was helpful, students in my class very active.",Other Comments: Good. Very Good.
2015-11-24T11:40:53,Good,1,,Just Right,2,,Good,1,,Excellent,0,,Excellent,0,,I did not seek help,5,,Interesting,1,,Excellent,0,,90-100%,0,,Very helpful,0,,Helpful,1,,No opinion,4,,Okay,2,,Okay,2,,11-15 hours,3,,What instructor has done well: Dave's a really fun presenter and he works hard to keep the class engaged.,Improvements to technique or style: Dave's pretty awesome.,"Course's strong points: As painful as it was to learn/use Racket, lists, and recursion for tasks that could be far easier completed using a more modern language, it certainly forces you to understand the concepts since there are no crutches, like variables, arrays, and iteration, available. I do believe that's the point of CS 135.","Course's weak points: Some of the earlier lectures were pretty boring, to be honest, for someone who already had experience with programming. That's not really something that can be fixed though, since not everyone taking the course starts at the same level.",Class atmosphere: Not in the least.,"Other Comments: I thought the class size and room (PHYS 150) were perfect for the course; the room was small enough to comfortably read the slides, and the class was small enough that anyone could ask questions."
2015-11-24T11:42:37,Excellent,0,,Just Right,2,,Good,1,,Excellent,0,,Excellent,0,,I did not seek help,5,,Very interesting,0,,Excellent,0,,90-100%,0,,Very helpful,0,,Helpful,1,,Not Helpful,2,,Okay,2,,Okay,2,,7-10 hours,2,,What instructor has done well: He was great at keeping the class engaged. Examples were very effective at demonstrating certain concepts too.,Improvements to technique or style: None,Course's strong points: Very interesting and fun.,Course's weak points: Occasionally too difficult,Class atmosphere: No,Other Comments: Fold-out tables were too small for my laptop. Would've liked a different room with proper tables
2015-11-24T11:46:30,Excellent,0,,Just Right,2,,Excellent,0,,Excellent,0,,Excellent,0,,I did not seek help,5,,Interesting,1,,Excellent,0,,90-100%,0,,Very helpful,0,,Very helpful,0,,No opinion,4,,Okay,2,,Okay,2,,3-6 hours,1,,"What instructor has done well: Dave is incredibly funny and engaging while remaining respectful and competent, and I respect him hugely for that. You can tell he really cares about his students and the material. CS135 was the course I was most dreading this semester but it quickly ended up becoming my favourite, in large part due to the amazing instructor. In high school (and even in some courses now) I tended to go over the material on my own at home instead of bothering to follow the lessons, but Dave's lectures are actually helpful and engaging. His sense of humour is very positive and sincere, the kind that makes you smile without making anyone feel bad.",Improvements to technique or style: Everything was fine.,Course's strong points: Assignments were fun and interesting without being too challenging.,"Course's weak points: Admittedly design recipe can be very helpful, but having to do it for every function got very tedious and unnecessarily time-consuming. Style guide could be a bit more specific. Sometimes the ""test coverage results"" were kind of too nitpicky for my liking.","Class atmosphere: Dave is a cool, funny, respectful guy, and he creates a very comfortable, relaxed class environment that lets us all focus on the course material while having fun.","Other Comments: The PHYS classroom was kinda cramped. The Lion King movie was a nice touch - made me really want to be punctual. Also my friend is a big fan of Dave's YouTuber cousin, so she's jealous of me now"
2015-11-24T11:54:25,Good,1,,Somewhat too high,1,,Excellent,0,,Excellent,0,,Excellent,0,,Always,0,,Interesting,1,,Excellent,0,,90-100%,0,,Helpful,1,,,,,No text required,3,,Somewhat too much,1,,Somewhat too much,1,,11-15 hours,3,,What instructor has done well: Dave is extremely engaging in lectures and does a great job of making somewhat boring topics interesting.,Improvements to technique or style: Great technique and style.,Course's strong points: Tough questions which require a lot of problem solving. I found racket great for learning programming.,Course's weak points: Quite a bit of focus on stepper questions on tests but almost not instruction on them in lectures.,Class atmosphere: Dave always managed to keep everyone laughing and engaged in class. His humour seemed to bring everyone together.,"Other Comments: Class size was good, could be smaller. The room was great and there was almost no noise."
2015-11-24T12:02:07,Excellent,0,,Just Right,2,,Good,1,,Excellent,0,,Excellent,0,,Always,0,,Interesting,1,,Excellent,0,,90-100%,0,,Very helpful,0,,Very helpful,0,,No text required,3,,Somewhat too much,1,,Somewhat too much,1,,7-10 hours,2,,"What instructor has done well: Coding in the class, which makes more clear for us to understand the step.",Improvements to technique or style: Maybe do some extra examples outside the course notes could help.,Course's strong points: Learn how to systematically build a function. Make us a logical mind.,Course's weak points: Assignments are a little bit to hard and the course covers too much modules than cs115.,"Class atmosphere: The instructor is really funny, so the atmosphere is positive."
2015-11-24T12:12:21,Excellent,0,,Just Right,2,,Good,1,"Sometimes, certain students may ask unnecessary questions that derail the class. At times like this, the instructor could improve upon ending these questions sooner and getting the class back on track.",Excellent,0,,Excellent,0,,I did not seek help,5,,Interesting,1,,Excellent,0,,90-100%,0,,Very helpful,0,,Helpful,1,,No opinion,4,,Somewhat too little,3,,Somewhat too much,1,,7-10 hours,2,,"What instructor has done well: Great energy, lectures were very enjoyable.
Analogies used when explaining difficult concepts were really good.",Improvements to technique or style: No comments.,Course's strong points: No comments,Course's weak points: No comments,Class atmosphere: No comments,Other Comments: No comments
2015-11-24T12:16:20,Excellent,0,,Just Right,2,,Excellent,0,,Excellent,0,,Excellent,0,,I did not seek help,5,,Interesting,1,,Excellent,0,,90-100%,0,,Helpful,1,,No printed notes,3,,No text required,3,,Somewhat too much,1,"Very fast-paced, so it was difficult to absorb the new material while trying to fully understand the previous material",Okay,2,,11-15 hours,3,,What instructor has done well: Willing to go through examples in class with the class as a whole and not just reference the slides,Improvements to technique or style: nothing,"Course's weak points: lambda, and trees and the number of test cases required for specific functions",Class atmosphere: No
2015-11-24T15:17:00,Excellent,0,,Just Right,2,,Excellent,0,,Excellent,0,,Excellent,0,,Often enough,2,,Interesting,1,,Excellent,0,,90-100%,0,,Not helpful,2,,No printed notes,3,,No text required,3,,Somewhat too much,1,,Too much,0,,7-10 hours,2,,"What instructor has done well: He's funny and interactive with the class, loved the lightsaber that he brought into class one lecture.","Improvements to technique or style: I personally LOVE the coded examples done in Racket, I would personally like to see more of this and MORE steppers because our 2 midterms and presumably the final would too.","Course's strong points: Dave's teaching style was very diverse, he included clear spoken lectures with coded examples and even drew some diagrams like trees when we started to learn them.","Course's weak points: Since this is a required class for certain majors, there isn't much motivation to do this course, but Dave made everything more interesting for a lot of people.","Class atmosphere: The class atmosphere was a little bit tense initially due to it being a first year class, but through Dave's humour and interactivity, a nice environment was created that allowed strangers to make friends with other people.","Other Comments: We were in the PHYS150 room and the class was always packed. There isn't much space in between each seat and also between rows, but this is the fault of the room and not much can be done. PHYS was a rather quiet building, so there were little to no distractions during lecture hours."
2015-11-24T15:20:39,Excellent,0,,Just Right,2,,Excellent,0,,Excellent,0,love those treeeeeeeeeeeeeeeeeeeeeeeeees,Good,1,"A little hard to catch up with, for EMLS students, but good enough most of the time",I did not seek help,5,,Very interesting,0,,Excellent,0,,90-100%,0,thanks to endless CQs,Very helpful,0,"but too much,(especially for the design recipe) , seriously",Helpful,1,,Not Helpful,2,,Okay,2,,Somewhat too much,1,,3-6 hours,1,it really depends on how many hours I spent on assignments,What instructor has done well: explain crucial examples functions clearly,"Improvements to technique or style: shorten the slides, decrease some repeated functions or useless descriptions. it's hard to find info."
2015-11-24T17:32:30,Excellent,0,,Just Right,2,,Excellent,0,Often jokes around with the students and converses during lectures :),Excellent,0,"I liked how Prof. Tompkins mainly taught interactively through Dr. Racket instead of just reading off of slides. Going through sample problems slowly together helped student learn how to discover solutions in a function paradigm. He also used his laptop well, I especially like how he doodles on his laptop screen to emphasize and illustrate certain points",Excellent,0,"Very enthusiastic, interesting person.",I did not seek help,5,,Interesting,1,"Though I have 5 years programming experience, functional programming is something else. Having no iteration or variables made seemingly simple problems very challenging and interesting.",Excellent,0,Tompkins for lyfe <3 I'll be no-lifing quest over the next few weeks trying to squeeze into his CS136 class.,90-100%,0,,Very helpful,0,,Helpful,1,"I didn't use the slides too often, but they are very thorough and go over the course content in depth.",No opinion,4,"Though we were often encouraged to read certain parts of the textbook, it didn't prove necessary to excel in the course.",Okay,2,"I was expecting first year CS would be all review for someone who's programmed before. We ended up going over a lot of stuff I already knew, but functional twists kept things interesting.",Okay,2,,3-6 hours,1,,"What instructor has done well: Tompkins did amazing at inspiring the many people in his class. Many people in CS135 have never programmed before, but Tompkins taught in a way that made even the least confident students feel able and competent. 

Showing a movie for the 5 minutes before class every day was a good idea, I forced myself to get to class on time multiple times for no reasons besides Lion King. All Hail Mufasa!",Improvements to technique or style: I was disappointed that day when we couldn't watch Lion King because someone stuffed the podium with cheese.,"Course's strong points: Because we used functional programming, the content was fairly new and engaging for students of all backgrounds and skill levels",Course's weak points: idunno,Class atmosphere: nop.,"Other Comments: The chairs in Physics 150 are very comfy,"
2015-11-24T17:47:17,Excellent,0,,Just Right,2,,Excellent,0,,Excellent,0,,Excellent,0,,Always,0,,Interesting,1,,Excellent,0,,90-100%,0,,Very helpful,0,,Very helpful,0,,Helpful,1,,Somewhat too much,1,,Somewhat too much,1,,11-15 hours,3,,What instructor has done well: He makes the class interesting so that everyone will pay attention. Would love to have him as my prof again in the next term.,Improvements to technique or style: No comments. He is an excellent prof.,"Course's strong points: Although there were a lot of assignment questions and it was tough, it was necessary for students to learn.",Course's weak points: Too much material especially the second half of the course when it transitions from locals to lambda.,Class atmosphere: The atmosphere was cheerful because Dave is always funny and full of energy.
2015-11-24T18:39:21,Excellent,0,,Just Right,2,,Excellent,0,,Excellent,0,,Excellent,0,,I did not seek help,5,,Very interesting,0,,Excellent,0,,90-100%,0,,Helpful,1,,No printed notes,3,,No text required,3,,Okay,2,,Okay,2,,3-6 hours,1,,What instructor has done well: Everything's been great,Improvements to technique or style: NA,Course's strong points: Good understanding in functions,Course's weak points: Too much on design recipes,Class atmosphere: Positive. Dave made the classes fun and enjoyable,Other Comments: NA
2015-11-24T18:53:09,Excellent,0,,Just Right,2,,Good,1,,Good,1,,Excellent,0,,Often enough,2,,Interesting,1,,Excellent,0,,90-100%,0,,Helpful,1,,Helpful,1,,Not Helpful,2,,Okay,2,,,,,7-10 hours,2,,What instructor has done well: 10/10 great instruction and kept class engage; his lectures helped fill us with determination,"Improvements to technique or style: some examples could have used more explaination and done more clearly, i.e. initial trees lecture, normally 8/10. 10/10 with further explaination and rice","Course's strong points: Movie clip showed at beginning, overall kept everyone well engaged, inspired us and filled us with determination","Course's weak points: Assignment 9 was hard, given the complexity of lambda, it gave us a bad time",Class atmosphere: No such disturbances exist,Other Comments: No problem here
2015-11-24T20:32:28,Excellent,0,,Just Right,2,,Excellent,0,,Good,1,,Excellent,0,,Always,0,,Very interesting,0,,Excellent,0,,90-100%,0,,Very helpful,0,,Helpful,1,,No opinion,4,,Okay,2,,Okay,2,,7-10 hours,2,,"What instructor has done well: Very engaging lectures, professor is hilarious and clearly loves CS. My favourite course of the year!","Improvements to technique or style: Sometimes talks a little quickly, though the lack of need for taking notes greatly diminishes the seriousness of this issue.","Course's strong points: Lots of feedback, examples, and effort by the instructors and tutorials to get you understanding the material at a good depth.","Course's weak points: The clicker questions all but disappeared by the end of the course, removing a valuable self-assessment tool.","Class atmosphere: Great attitude by the professor and the students, made the class a pleasure to attend.","Other Comments: Lecture was a good size, room was suitable and comfortable."
2015-11-24T20:32:38,Excellent,0,,Just Right,2,,Excellent,0,,Good,1,,Excellent,0,,Always,0,,Interesting,1,,Excellent,0,,90-100%,0,,Helpful,1,,No opinion,4,,Not Helpful,2,,Okay,2,,Somewhat too much,1,,11-15 hours,3,,What instructor has done well: Clearly explained the topics in the course. Easy to understand,Improvements to technique or style: None,Course's strong points: Teaches data structures and recursion well,Course's weak points: Abstract list functions,Class atmosphere: No comment,Other Comments: Class size was fine
2015-11-24T23:45:03,Excellent,0,,Just Right,2,,Excellent,0,,Excellent,0,,Excellent,0,,Always,0,,Interesting,1,,Excellent,0,,90-100%,0,,Very helpful,0,,Helpful,1,,No text required,3,,Okay,2,,Okay,2,,7-10 hours,2,,"Course's weak points: The stepper is so confusing, more examples need to be provided"
2015-11-24T23:47:29,Excellent,0,,Just Right,2,,Excellent,0,,Excellent,0,,Excellent,0,,I did not seek help,5,,Interesting,1,,Excellent,0,,90-100%,0,,Very helpful,0,,No printed notes,3,,No text required,3,,Okay,2,,Okay,2,,7-10 hours,2,,"What instructor has done well: Dave truly understood us students in the class. He would realize when we were ""zoning"" out while he was lecturing us. Instead of forcing the information on us, he would slightly diverge from the topic and gain our attention through light-hearted jokes or pop-culture references. Once he had regained our attention he would continue lecturing us on the material at hand. I feel that this is one of the strong points of his teaching style as forcing the information on students that have ""zoned"" out would only make them ""zone"" out further.",Improvements to technique or style: Nothing. His teaching strategy was extremely adequate.,"Course's strong points: Lectured flowed in an extremely logical manner. The Course is laid out in very nice way in that it makes it easy for students to learn the material. There are no ""vague topics"" in the course. Concepts are covered extremely thoroughly.",Course's weak points: We spent a bit to much time on introductory material leaving perhaps not enough time to cover more advanced concepts.,Class atmosphere: The class atmosphere was definitely positively affected by the instructor's attitude. Dave came to every lecture in an extremely good mood which in turn made the students eager to learn. It was a very happy atmosphere.,Other Comments: No.
2015-11-25T12:14:45,Excellent,0,,Just Right,2,,Excellent,0,,Excellent,0,,Excellent,0,,I did not seek help,5,,Very interesting,0,,Excellent,0,,90-100%,0,,Very helpful,0,,Helpful,1,,Helpful,1,,Okay,2,,Somewhat too much,1,,11-15 hours,3,,What instructor has done well: Dave is excellent! I hope I can stick with him for my CS 135.,Improvements to technique or style: I hope the instructor can provide some hints for assignment questions.,Course's weak points: The class is a bit too long for this large amount of materials. I lost my focus sometimes when the materials are too overwhelming.
2015-11-25T13:28:20,Excellent,0,,Just Right,2,,Excellent,0,,Excellent,0,,Excellent,0,,Always,0,,Interesting,1,,Excellent,0,,90-100%,0,,Helpful,1,,No printed notes,3,,Not Helpful,2,,Somewhat too much,1,,Somewhat too much,1,,7-10 hours,2,,"What instructor has done well: Kept the class entertaining, but at the same time explained everything clearly",Class atmosphere: The classroom was affected positively by attitudes of the instructor.
2015-11-25T20:38:03,Excellent,0,,Just Right,2,,Excellent,0,,Excellent,0,,Excellent,0,,Always,0,,Very interesting,0,,Excellent,0,,90-100%,0,,Very helpful,0,,No printed notes,3,,Helpful,1,,Okay,2,,Okay,2,,7-10 hours,2,,What instructor has done well: Made the lectures interesting and gave great explanations. Would do a lot of live examples making it really easy to follow what he was doing instead of just looking at slides.
2015-11-25T22:46:45,Good,1,,Just Right,2,,Good,1,,Good,1,,Excellent,0,,I did not seek help,5,,Very interesting,0,,Excellent,0,,90-100%,0,,Very helpful,0,,Very helpful,0,,No opinion,4,,Okay,2,,Okay,2,,7-10 hours,2,,What instructor has done well: He's a funny guy.,Improvements to technique or style: He could explain the slides a bit more.,Course's strong points: Teaches the basic concepts of programming well,Course's weak points: Assignment 9 was the worst by far. Some questions had too many restrictions and were very closed-ended.
2015-11-26T06:09:41,Excellent,0,,Just Right,2,,Excellent,0,,Excellent,0,,Excellent,0,,Most of the time,1,,Very interesting,0,,Excellent,0,,90-100%,0,,Very helpful,0,,No printed notes,3,,No text required,3,,Somewhat too little,3,,Okay,2,,3-6 hours,1,,"What instructor has done well: Love the movies played 5 min before class starts, it helped me wake up. The lectures are very easy to understand and the use of ""Racket Hat"" makes the class hilarious","Improvements to technique or style: What is there to be improved on when it is already perfect
But the audio should be improved faster","Course's strong points: The material is very easy to understand after taught by the prof. Very humorous and intellectual teaching style. 
Also, the change in voice for the mutual recursion should definitely be continued. Do have water next to you next time so you don't lose your voice",Course's weak points: The Doctor Racket hat needs to exist in real life!,Class atmosphere: Absolutely positively effective. Everyone fall in love with CS after hanging out with this prof. Also thank you for the empathy when we have a long hw assignment.,"Other Comments: The class size is reasonable, but it will be nice if we get to switch seats so we can get to know more people. I still have no idea who is in my cs class up till this point."
2015-11-26T14:02:31,Good,1,,Somewhat too high,1,,Excellent,0,,Satisfactory,2,,Excellent,0,,Always,0,,Interesting,1,,Excellent,0,,90-100%,0,,Very helpful,0,,No printed notes,3,,Not Helpful,2,,Somewhat too much,1,,Too much,0,,11-15 hours,3,,"What instructor has done well: Dave is always enthusiastic, make me have passion on this course.",Improvements to technique or style: He should be slower in certain difficult points like mutual recursion.,Course's strong points: It helps me to build a logical mind and get to know how computers think,"Course's weak points: Too hard, the assignment is too much that i have time to review after doing it.","Class atmosphere: No, all the instructors and students are nice.",Other Comments: The classroom is too close that make me feel sleepy because the lack of oxygen.
2015-11-26T14:27:29,Excellent,0,,Just Right,2,,Excellent,0,,Good,1,,Good,1,,Always,0,,Interesting,1,,Excellent,0,,75-90%,1,,Helpful,1,,Helpful,1,,Not Helpful,2,,Somewhat too much,1,,Somewhat too much,1,,7-10 hours,2,,What instructor has done well: Dave made the class really enjoyable and fun to go to. Dave was always available to answer any questions and was extremely helpful.,Improvements to technique or style: Perhaps spend a bit more time on stepper problems and clarity on lambda functions.,Course's strong points: Some of the assignments were really fun to do as they had fun questions.,Course's weak points: Some assignments were a bit too difficult and stressful.
2015-11-26T17:43:17,Excellent,0,,Just Right,2,,Excellent,0,,Excellent,0,,Excellent,0,,Always,0,,Very interesting,0,,Excellent,0,,90-100%,0,,Helpful,1,,Very helpful,0,,Not Helpful,2,,Okay,2,,Okay,2,,7-10 hours,2,,What instructor has done well: very interesting prof and explain everything very well.,Improvements to technique or style: Nothing,Course's strong points: everything,Course's weak points: nothing,Class atmosphere: No opinion,Other Comments: good
2015-11-26T19:12:46,Excellent,0,,Just Right,2,,Excellent,0,,Excellent,0,,Excellent,0,,Always,0,,Interesting,1,,Excellent,0,,90-100%,0,,Very helpful,0,,Helpful,1,,Not Helpful,2,,Somewhat too much,1,,Somewhat too much,1,,> 15 hours,4,,What instructor has done well: The fact that Dave taught this course made me want to come to every lecture. He did not only make the lectures fun but he introduced new concepts to students like myself very well.,Improvements to technique or style: Nothing to be improved.,Course's strong points: Assignments were designed well so that students would understand the material better. Classes were well taught. Concepts were very interesting.,Course's weak points: Classes only being two times a week made it very difficult to remember last lecture's content. Tutorials were not taught well or reinforce ideas properly. A lot of time was spent on easy concepts (before trees) and I think we should have gone through those concepts faster.,Other Comments: I enjoyed the free food.
