2015-11-26T19:23:23,Excellent,0,,Just Right,2,,Good,1,,Excellent,0,,Excellent,0,,Always,0,Office hours were extremely helpful,Interesting,1,,Excellent,0,,75-90%,1,,Helpful,1,,Not helpful,2,,Not Helpful,2,Textbook was useless.,Too much,0,,Too much,0,,> 15 hours,4,,"What instructor has done well: One of the best profs! Makes lectures interesting and fun, I actually enjoy coming to class. Goes over the material at a good pace and answers any questions students have. Loved watching the lion king and the comparison between recursion and drug use. Some of the course material was dry but Dave tried his best to keep everyone awake.","Improvements to technique or style: Only feedback is to have more steeper problems. Otherwise, keep doing what you're doing!",Course's strong points: Learned a lot of basic skills that you will need for future cs courses. I know that this builds a good foundation for cs students and teaches you to think in a problem-solving way.,"Course's weak points: Too much material given too fast. It was hard to learn all the concepts. There's still stuff that I don't fully understand and some assignments were poorly organized. The assignment with trees was useless and I still don't know how to use trees or their purpose. Also, assignment 9 was way too hard, I barely understood the concepts and had to implement them in complicated code. 
On midterm 2, the stepper problems were too hard and the overall exam was too long.",Class atmosphere: Positively by both instructor and students.,"Other Comments: Class size was perfect but chairs were too comfy, always fell asleep in class."
2015-11-26T21:50:57,Good,1,,Just Right,2,,Excellent,0,,Good,1,,Excellent,0,,Often enough,2,,Interesting,1,,Excellent,0,,90-100%,0,,Very helpful,0,,Helpful,1,,No text required,3,,Somewhat too much,1,,Somewhat too much,1,,11-15 hours,3,
2015-11-27T09:10:41,Excellent,0,,Just Right,2,,Excellent,0,,Excellent,0,,Excellent,0,,Often enough,2,,Very interesting,0,,Excellent,0,,90-100%,0,,Helpful,1,,No printed notes,3,,No text required,3,,Okay,2,,Okay,2,,7-10 hours,2,,"What instructor has done well: He has made the classes very interesting and attractive, and was able to explain the new knowledge in a way that was easy for students to understand."
2015-11-27T16:11:38,Excellent,0,,Just Right,2,,Excellent,0,,Excellent,0,,Excellent,0,,Most of the time,1,,Very interesting,0,,Excellent,0,,90-100%,0,,Helpful,1,,Very helpful,0,,Not Helpful,2,,Okay,2,,Somewhat too much,1,,7-10 hours,2,,"What instructor has done well: Everything. Amazing prof who loves his job, and it really shows.","Course's weak points: Design recipe is unrealistic, and should be reduced."
2015-11-29T01:42:40,Excellent,0,,Just Right,2,,Excellent,0,,Excellent,0,,Excellent,0,,I did not seek help,5,,Very interesting,0,,Excellent,0,,90-100%,0,,Helpful,1,"The assignments seemed unnecessarily difficult sometimes (the exams seemed to aim at the right level, and even though I know that the assignments are supposed to take longer to figure out, they sometimes just felt TOO strenuous)",Very helpful,0,The PPT slides are A+ (unlike my grades :c),No opinion,4,,Somewhat too much,1,,Too much,0,,11-15 hours,3,,"What instructor has done well: EVERYTHING! Dave is an amazing lecturer, and person overall. Even though I haven't really talked to him outside class, I can tell that he's a wonderful person just by the way that he interacts with the class. As well, I love all the funny references he makes during class.

ALSO, he taught with a lightsaber once. And he did this high voice/low voice thingy... I loved it. Dave 4 prez",Improvements to technique or style: It's perfect! :),Course's strong points: HAVING DAVE AS AN INSTRUCTOR!!!!,Class atmosphere: Nopeeee
2015-11-30T12:08:06,Excellent,0,,Just Right,2,,Excellent,0,,Excellent,0,,Excellent,0,,Always,0,,Very interesting,0,,Excellent,0,,90-100%,0,,Very helpful,0,,No printed notes,3,,No text required,3,,Okay,2,,Okay,2,,7-10 hours,2,,"What instructor has done well: Professor Tompkins is an outstanding professor. He teaches CS brilliantly both in depth and in humor. There isn't enough good things to say about him, just that he is the best professor/teacher I've ever had to date.","Improvements to technique or style: I honestly don't think there is really much that he could actually even improve on, given how excellent his teaching was. If anything, just more light sabers and the amazing voice acting! (Don't break your voice though)","Course's strong points: Humor, depth, engaging, and interesting. A few of the strong points that has been demonstrated by this course.",Course's weak points: None at all.,Class atmosphere: None at all.,"Other Comments: Perfect really, the class wasn't big and there wasn't any noise."
2015-11-30T12:08:54,Excellent,0,,Just Right,2,,Excellent,0,,Excellent,0,,Excellent,0,,Always,0,,Interesting,1,,Excellent,0,,90-100%,0,,Helpful,1,,Helpful,1,,Helpful,1,,Somewhat too much,1,,Too much,0,,11-15 hours,3,,"What instructor has done well: Dave explained everything clearly, interestingly and completely",Improvements to technique or style: Dave speaks a little fast
2015-11-30T12:19:18,Good,1,,Just Right,2,,Good,1,,Excellent,0,,Excellent,0,,I did not seek help,5,,Very interesting,0,,Excellent,0,,90-100%,0,,Very helpful,0,,No printed notes,3,,No text required,3,,Okay,2,,Okay,2,,7-10 hours,2,,What instructor has done well: His is the most hilarious professor I have and never fails to keep the class on their feet for long enough to understand lectures. Lectures are very much worth attending.,Improvements to technique or style: Just a little extra clarity in explaining some of the later examples (although the professor has many times explained how the examples themselves were not the best to use and would be changed were it up to him).,Course's strong points: The assignments and lectures.,Course's weak points: Every now and then an iffy example will show up that doesn't really clearly show what it's trying to show.,Class atmosphere: No,Other Comments: Dave is perfect. <3
2015-11-30T12:40:30,Excellent,0,,Just Right,2,,Excellent,0,,Excellent,0,,Excellent,0,,Most of the time,1,,Very interesting,0,,Excellent,0,,90-100%,0,,Very helpful,0,,Helpful,1,,Not Helpful,2,,Okay,2,,Somewhat too much,1,,11-15 hours,3,,"What instructor has done well: Although the examples are provided in the slides, I like how Dave still opens up a tab in racket and writes the code/examples out with us so that we can understand at a better pace- instead of throwing the example at us and leaving us to understand it all at once.","Course's weak points: lambda, and the uses of lambda. I felt that there was little coverage on this function- and I struggled  a lot with one of the assignments even after using the slides, online resources and the textbook. It would have been nice to see more examples.","Other Comments: The class room was very cramped, small and dark- but I guess that's because it was an old building. (Phys Building)"
2015-11-30T13:38:54,Excellent,0,,Somewhat too low,3,,Good,1,,Excellent,0,,Excellent,0,,Most of the time,1,,Interesting,1,,Excellent,0,,90-100%,0,,Helpful,1,,Helpful,1,,Helpful,1,,Too much,0,,Somewhat too much,1,,11-15 hours,3,,What instructor has done well: Dave kept all lectures very interesting and provided many of his own examples supplementary to course slides,"Improvements to technique or style: Perhaps going slower on certain harder concepts (abstract functions, lambda) would have helped",Course's strong points: learned a lot of new things,Course's weak points: far too time consuming,Class atmosphere: good class atmosphere,Other Comments: n/a
2015-11-30T14:13:28,Excellent,0,,Somewhat too high,1,,Excellent,0,,Excellent,0,,Excellent,0,,Always,0,,Very interesting,0,,Excellent,0,,90-100%,0,,Very helpful,0,,Very helpful,0,,Helpful,1,,Too much,0,,Somewhat too much,1,,> 15 hours,4,>30 hours lol,What instructor has done well: Very funny and good lectures.,Improvements to technique or style: Everything was good.,Course's strong points: Lectures were clear and engaging.,"Course's weak points: Nothing, everything was good.",Class atmosphere: The class atmosphere was always good.,Other Comments: I loved this class even though I suck and feel bad about it. Thank you prof for everything!! :D
2015-11-30T14:35:10,Excellent,0,,Just Right,2,,Excellent,0,,Excellent,0,,Excellent,0,,I did not seek help,5,,Very interesting,0,,Excellent,0,,50-75%,2,,Very helpful,0,,Very helpful,0,,Very Helpful,0,,Okay,2,,Okay,2,,3-6 hours,1,
2015-11-30T16:25:05,Excellent,0,,Just Right,2,,Excellent,0,,Excellent,0,,Excellent,0,,Always,0,,Very interesting,0,,Excellent,0,,90-100%,0,,Very helpful,0,,Very helpful,0,,Very Helpful,0,,Okay,2,,Okay,2,,> 15 hours,4,
2015-11-30T17:34:21,Excellent,0,,Just Right,2,,Excellent,0,,Excellent,0,,Excellent,0,,Most of the time,1,,Very interesting,0,,Excellent,0,,90-100%,0,,Helpful,1,,Helpful,1,,No text required,3,,Okay,2,,Okay,2,,11-15 hours,3,,What instructor has done well: Everything was great. Dave is interesting and he can engage students listen in class and follow the lecture moving on.,"Improvements to technique or style: Generally pretty good, could given more complicated examples in class.",Course's strong points: Gave a great idea of functional programming to students whether they have programming background or not.,Course's weak points: Some assignments were a bit too hard to do.,Class atmosphere: Positive atmosphere were created by instructor. Excellent,"Other Comments: Pretty good class, i enjoyed the first cs course in university."
2015-11-30T18:10:07,Good,1,,Just Right,2,,Good,1,,Excellent,0,,Excellent,0,,I did not seek help,5,,Very interesting,0,,Excellent,0,,90-100%,0,,Very helpful,0,,No opinion,4,Did not use.,No text required,3,,Okay,2,,Okay,2,,7-10 hours,2,Some assignments required a lot more time than others. This is not just the case that assignments are increasing in difficulty.,"What instructor has done well: Very humorous and engaging, but still manages to be informative and stay on topic. Gives great pointers and precautions.","Improvements to technique or style: Sometimes cuts students off when they are asking questions. Does not seek class participation very often - unless we catch him making a mistake.
*The Esc+P trick was never taught in class. I was wondering how it was done until we were shown the trick in tutorials. I never would have figured out that it was not actually a Ctrl command.","Course's strong points: Course manages to make a transition to Racket not feel overwhelming. Additionally, course material is more conceptual. I feel like I am working smarter rather than trying everything until something works.
  Assignments are interesting and relevant to course material. Difficulty of assignments encourage us to better understand course material.
  Clickers are a great way to encourage class participation.","Course's weak points: There is a sudden increase in difficulty at around module 8. Assignments suddenly get a lot harder at that point.
  Later assignments were very vague and had unhelpful examples. This is most exemplified in assignment 08. In question #3, nowhere does it state that we are required to count replies of replies, and the examples do not clarify that. It had to be clarified on Piazza, which shows how unclear the question is.
  Some material did not feel useful in the slightest. I never used template functions nor did I ever find them necessary or helpful.
  Tutorials are not very well organized. Gives ""group problems"" but we do not work in groups. We do not have enough time to work on them thoroughly either. Thus, tutorials are not very helpful. This is proven by the number of students who show up for tutorials on week 1 compared to on week 10.","Other Comments: Class size keeps getting exponentially smaller. Worst case I've seen in all of my classes so far.
  Floor elevation was not steep enough. Had trouble seeing over tall people's heads. This is in particular if they had really weird hair.
  People who use Reddit during class time are mildly distracting.
  The audio in Physics 150 took too long to get fixed."
2015-11-30T20:04:39,Excellent,0,,Just Right,2,,Excellent,0,,Excellent,0,,Excellent,0,,Always,0,,Very interesting,0,,Excellent,0,,90-100%,0,,Very helpful,0,,Very helpful,0,,Helpful,1,,Okay,2,,Too much,0,Design recipe was a little excessive.,> 15 hours,4,,What instructor has done well: Lectures so good that it made [name removed] actually show up to class (that's pretty hard to do),Improvements to technique or style: '() <- my idea,"Course's strong points: Functional abstraction, Trees",Course's weak points: Design recipe
2015-11-30T21:48:29,Good,1,,Just Right,2,,Excellent,0,,Excellent,0,,Excellent,0,,Often enough,2,,Interesting,1,,Excellent,0,,90-100%,0,,Very helpful,0,,Helpful,1,,Helpful,1,,Okay,2,,Somewhat too much,1,,3-6 hours,1,,"What instructor has done well: His methods of explaining new concepts was very good, and he was always very interactive with the students keeping lectures interesting","Course's strong points: Dave Tompkins, and The Lion King",Course's weak points: assignments at the end of the term proved challenging
2015-11-30T22:32:06,Good,1,,Just Right,2,,Excellent,0,,Excellent,0,,Excellent,0,,Most of the time,1,,Interesting,1,,Excellent,0,,90-100%,0,,Helpful,1,,Helpful,1,,Helpful,1,,Okay,2,,Somewhat too much,1,,11-15 hours,3,,What instructor has done well: movie before class
2015-12-01T10:00:21,Excellent,0,,Just Right,2,,Excellent,0,,Excellent,0,,Excellent,0,,Often enough,2,,Very interesting,0,,Excellent,0,,90-100%,0,,Helpful,1,,Helpful,1,,No text required,3,,Okay,2,,Okay,2,,7-10 hours,2,,What instructor has done well: Really excellent visual presentation. Easy to understand.,Improvements to technique or style: Nothing,"Course's strong points: Graphs, Binary Search Trees and Abstraction",Course's weak points: Nothing,Class atmosphere: Not in my opinion,"Other Comments: Class size is just right, Room had audio issues, Noise level was at minimum"
2015-12-01T10:31:58,Excellent,0,,Just Right,2,,Excellent,0,,Excellent,0,,Good,1,,Always,0,,Very interesting,0,,Excellent,0,,90-100%,0,,Helpful,1,,Helpful,1,,No text required,3,,Okay,2,,Okay,2,,3-6 hours,1,
2015-12-01T10:35:16,Excellent,0,,Just Right,2,,Excellent,0,,Excellent,0,,Excellent,0,,Always,0,,Very interesting,0,,Excellent,0,,50-75%,2,,Very helpful,0,,Very helpful,0,,Not Helpful,2,,Okay,2,,Okay,2,,3-6 hours,1,,What instructor has done well: Good at teaching.,Improvements to technique or style: Change dry examples from the course.,Course's strong points: Bonus questions.,Course's weak points: Design Recipe.,Class atmosphere: Positively.,Other Comments: Room was cramped.
2015-12-01T10:35:29,Excellent,0,,Just Right,2,,Excellent,0,,Excellent,0,,Excellent,0,,Always,0,,Very interesting,0,,Excellent,0,,90-100%,0,,Helpful,1,,Helpful,1,,Helpful,1,,Okay,2,,Somewhat too much,1,,7-10 hours,2,
2015-12-01T10:38:59,Excellent,0,,Just Right,2,,Good,1,,Excellent,0,,Good,1,,Most of the time,1,,Interesting,1,,Excellent,0,,75-90%,1,,Helpful,1,,No printed notes,3,,Helpful,1,,Okay,2,,Somewhat too much,1,,7-10 hours,2,,What instructor has done well: good,Improvements to technique or style: do more light sabers,Course's strong points: coding,Course's weak points: N/A,Class atmosphere: positive,Other Comments: good job Dave
2015-12-01T10:39:06,Excellent,0,,Just Right,2,,Excellent,0,,Excellent,0,,Excellent,0,,Most of the time,1,,Interesting,1,,Good,1,,90-100%,0,,Helpful,1,,No printed notes,3,,No opinion,4,,,,,Okay,2,,7-10 hours,2,,What instructor has done well: Very interesting explanation.,Course's strong points: A lot of clicker questions to help the courses.,"Course's weak points: Only two  classes per week.
The clicker questions always tricky.",Class atmosphere: Positive.
2015-12-01T17:00:06,Excellent,0,,Just Right,2,,Excellent,0,,Good,1,,Good,1,,Always,0,,Very interesting,0,,Excellent,0,,90-100%,0,,Helpful,1,,Very helpful,0,,No opinion,4,,Okay,2,,Okay,2,,7-10 hours,2,
2015-12-02T12:14:44,Excellent,0,,Just Right,2,,Excellent,0,,Good,1,,Excellent,0,,Always,0,,Interesting,1,,Excellent,0,,90-100%,0,,Very helpful,0,,Helpful,1,,Not Helpful,2,,Okay,2,,Okay,2,,7-10 hours,2,,What instructor has done well: Kept all students engaged through great lectures.,Improvements to technique or style: Spend more time on actual working examples rather than on slides.,Course's strong points: Very interesting fundamental concepts of computer science.,"Course's weak points: Language is not very applicable to real work, but I understand that it's the concepts that count.",Class atmosphere: No.
2015-12-02T14:19:27,Excellent,0,,Just Right,2,,Excellent,0,,Excellent,0,,Excellent,0,,Often enough,2,,Very interesting,0,,Excellent,0,,90-100%,0,,Helpful,1,,Helpful,1,,Not Helpful,2,,Okay,2,,Too much,0,,> 15 hours,4,,What instructor has done well: Dave is the beeeeeeeeeeest!,Improvements to technique or style: My Neighbour Totoro needed!!
2015-12-05T20:55:02,Excellent,0,,Just Right,2,,Good,1,,Excellent,0,,Excellent,0,,I did not seek help,5,,Interesting,1,,Excellent,0,,50-75%,2,,Helpful,1,,Helpful,1,,No text required,3,,Somewhat too much,1,,Too much,0,Approximately double the work of Math 135 and Math 137.,7-10 hours,2,Was seldom able to finish assignments.,"What instructor has done well: Really engages the class. Treats it like a performance, yet teaches everything that needs to be taught, leaving us both entertained and informed.","Improvements to technique or style: Would very occasionally stress and reiterate concepts that need not be reiterated. Asking for a show of hands on who understands the particular point might be an effective method to combat this. However, most of the times when Dave Tompkins stressed a point, it was for good reason and done the right amount.",Course's strong points: Learning recursion so thoroughly and being instructed in a fun way.,"Course's weak points: Assignments far too long to complete in a reasonable amount of time, and also at times a bit more complex than I believe is needed to understand the concept. For some questions, it felt more like the writers were attempting to create an extremely challenging question rather than a helpful question. This was the minority of the questions, however. Also, the rigid design recipe was a time waster, which I believe could be better used in understanding the coding practices. I believe that code should be marked for being understandable and correct, not for following a rigid formula of style.",Class atmosphere: Nope. No discrimination.,Other Comments: The room was a good place.
2015-12-05T21:54:58,Good,1,,Somewhat too high,1,,Satisfactory,2,,Good,1,,Excellent,0,,Often enough,2,,Very interesting,0,,Excellent,0,,90-100%,0,,Helpful,1,,Not helpful,2,,No text required,3,,Somewhat too much,1,,Too much,0,,7-10 hours,2,,What instructor has done well: Lectures are funny. Typing out examples are helpful.
2015-12-05T21:56:49,Excellent,0,,Just Right,2,,Excellent,0,,Excellent,0,,Excellent,0,,Always,0,,Very interesting,0,,Excellent,0,,75-90%,1,,Very helpful,0,,Helpful,1,,No opinion,4,,Somewhat too much,1,,Too much,0,,> 15 hours,4,
